{
  "schema": "hb/lifecycle/1",
  "task_id": "fix-pagination-off-by-one",
  "rep": 3,
  "attempts": 1,
  "harness_image": "ghcr.io/sigormatt/hb-harness-baseline@sha256:409c20e79d103d2102749da8882b2869f653c5c6356fbb43eb64cb7f2c079ed7",
  "started_at_ms": 1760711300000,
  "ended_at_ms": 1760712500000,
  "termination": "wall_timeout",
  "exit_code": 137
}
